{
  "schema": "agent-result-v1",
  "task": "TASK-412",
  "outcome": "implemented",
  "changed_files": [
    "plugins/pyramid-task/references/agent-contracts.md",
    "plugins/pyramid-task/references/intra-task-helpers.md",
    "plugins/pyramid-task/references/development-harness.md",
    "plugins/pyramid-task/skills/take/SKILL.md",
    "plugins/pyramid-task/skills/resume/SKILL.md",
    "proof-output/v4.1/TASK-412/review.md",
    "proof-output/v4.1/TASK-412/pre-run-capture.json",
    "proof-output/v4.1/TASK-412/agent-result.json"
  ],
  "changed_assets": [
    "ASSET-GUIDANCE"
  ],
  "change_effect": "mixed",
  "changes": [
    {
      "path": "plugins/pyramid-task/references/agent-contracts.md",
      "class": "source"
    },
    {
      "path": "plugins/pyramid-task/references/intra-task-helpers.md",
      "class": "source"
    },
    {
      "path": "plugins/pyramid-task/references/development-harness.md",
      "class": "source"
    },
    {
      "path": "plugins/pyramid-task/skills/take/SKILL.md",
      "class": "source"
    },
    {
      "path": "plugins/pyramid-task/skills/resume/SKILL.md",
      "class": "source"
    },
    {
      "path": "proof-output/v4.1/TASK-412/review.md",
      "class": "evidence"
    },
    {
      "path": "proof-output/v4.1/TASK-412/pre-run-capture.json",
      "class": "evidence"
    },
    {
      "path": "proof-output/v4.1/TASK-412/agent-result.json",
      "class": "evidence"
    }
  ],
  "checks": [
    {
      "command": "PYRAMID_USAGE=off PYTHONDONTWRITEBYTECODE=1 .venv/bin/python tools/validate_repository.py",
      "result": "passed"
    },
    {
      "command": "git diff --check",
      "result": "passed"
    }
  ],
  "discovered_risks": [
    "Static contract review only. Actual dynamic join and two-host qualification remain pending."
  ],
  "suggested_graph_changes": [],
  "proofs": [
    {
      "requirement": "EV-412",
      "run": {
        "contract_sha256": "acf890e363ddf7d2b243d57624654394b95a5c7d7c06bf70f620a2b7e3cb602b",
        "inputs_sha256": "774d744f3eefddc52e0032b69acd706b4dab21d02f45e8a63b768eeb98d9abfb",
        "environment": "Disposable local projects and owned test processes; no production, personal credentials or existing installations. Record candidate, runtime, host/model identity when applicable. Failed/not-run observations remain visible.",
        "observations": [
          {
            "kind": "internal",
            "result": "passed",
            "summary": "Reviewed stable-source/fresh-invocation contract against actual current runtime guard and helper rules. Lease changes do not require executable-source edits; stale current guard, changed proof inputs, denied host permissions and older helper evidence remain distinct refusals. Dynamic join is pending GATE-419.",
            "reviewer": "Codex same-session contract review",
            "artifacts": [
              {
                "path": "proof-output/v4.1/TASK-412/review.md",
                "sha256": "578166c73cde3764078292c8403f214f88df5593d169f6b832ff28d9950d6a05"
              },
              {
                "path": "proof-output/v4.1/TASK-412/pre-run-capture.json",
                "sha256": "adf86e77641271199a0bdb567b7ec55798284959f0e8aabd827a5bb1cbaa0126"
              }
            ]
          }
        ]
      }
    }
  ]
}
