{
  "schema": "agent-result-v1",
  "task": "GATE-419",
  "outcome": "implemented",
  "changed_files": [
    "proof-output/v4.1/GATE-419/agent-result.json"
  ],
  "changed_assets": [],
  "change_effect": "evidence-only",
  "changes": [
    {
      "path": "proof-output/v4.1/GATE-419/agent-result.json",
      "class": "evidence"
    }
  ],
  "checks": [
    {
      "command": "Join actual current scoped observations and independent review; validate inherited run identity and source before gate submission",
      "result": "passed"
    }
  ],
  "discovered_risks": [
    "Qualified local source only; measured native decision/cache/budget and runtime/environment/history limitations retained."
  ],
  "suggested_graph_changes": [],
  "proofs": [
    {
      "requirement": "EV-GATE-419",
      "run": {
        "contract_sha256": "86d269f6d6413ac992d540cc668b5ceb8134d4d958c432391e59824a3d98c38d",
        "inputs_sha256": "2f1b9eb71e368b2c14209e47b11f353ff407aac46a05143abaeb8fd0a3786161",
        "environment": "Disposable local projects and owned test processes; no production, personal credentials or existing installations. Record candidate, runtime, host/model identity when applicable. Failed/not-run observations remain visible.",
        "observations": [
          {
            "kind": "external",
            "result": "passed",
            "summary": "Actual joined provider/consumer/composition and guard CLI observations, inherited current tests and separate independent evidence review. New consumers remain unverified until accepted; changed source and stale guards refuse.",
            "reviewer": "independent Claude native review; joined by codex-pyramid41-worker",
            "artifacts": [
              {
                "path": "proof-output/v4.1/TASK-432/recovery-final-result.json",
                "sha256": "03b0a43d4bd9d77ab37bc1900bce79eb7ad3a71279b89a6a55b48382162d1dfa"
              },
              {
                "path": "proof-output/v4.1/TASK-432/guard-qualified-result.json",
                "sha256": "677fc0ac7f0f2fd876ef0857ffd4b5528d71f3398b8eca1404f159591a728699"
              },
              {
                "path": "proof-output/v4.1/TASK-432/qualification.md",
                "sha256": "27c3323323aca6f8950d7592595688d99062a0ef11b47f2346f75a9471355ed9"
              },
              {
                "path": "proof-output/v4.1/TASK-432/join-review.md",
                "sha256": "654b22dba4bfa83411f2043501bdff8063ae25fd9b9e5cb20f1637fa07f5d84e"
              },
              {
                "path": "proof-output/v4.1/TASK-422/summary.md",
                "sha256": "4a96c93357284549da57be9598597750e343195c026ca9b81cc8230e3dbff70e"
              }
            ]
          },
          {
            "kind": "internal",
            "result": "passed",
            "summary": "Actual joined provider/consumer/composition and guard CLI observations, inherited current tests and separate independent evidence review. New consumers remain unverified until accepted; changed source and stale guards refuse.",
            "reviewer": "independent Claude native review; joined by codex-pyramid41-worker",
            "artifacts": [
              {
                "path": "proof-output/v4.1/TASK-432/join-review.md",
                "sha256": "654b22dba4bfa83411f2043501bdff8063ae25fd9b9e5cb20f1637fa07f5d84e"
              },
              {
                "path": "proof-output/v4.1/TASK-432/qualified-tests.txt",
                "sha256": "1c9a63bf5110a45acff0699e74b541c234e3d219ed3cbfed527e53c5a80660e1"
              },
              {
                "path": "proof-output/v4.1/TASK-432/qualified-validation.txt",
                "sha256": "a1ae9b67ea2ff3d0bf0b54c6ba537f739463a34938b4a39ca0d73b57ab3bb9ab"
              },
              {
                "path": "proof-output/v4.1/TASK-432/review-package-identity.json",
                "sha256": "fdfe552028a7749d90efb170f3fc8462fe8e013e6be5d07f4e9ca072e1dff037"
              },
              {
                "path": "proof-output/v4.1/TASK-432/independent-review-final-result.json",
                "sha256": "ee59428ada162bae6d5621b74fcbf572c360d0a58962f09eae5473d43b8631bd"
              },
              {
                "path": "proof-output/v4.1/TASK-432/current-footprint.json",
                "sha256": "4d14992dade1215561881897eaffb61ab00f98df5e049495004ac245bb89e41f"
              }
            ]
          }
        ]
      }
    }
  ]
}
